,Title,Link,Snippet
72,Verification and validation in computational engineering and science: basic concepts,https://www.sciencedirect.com/science/article/pii/S0045782504001781,"… the software engineering processes of determining if the code faithfully implements the 
computational … with which the mathematical model is approximated by the computational model. …"
73,"Elegant object-oriented software design via interactive, evolutionary computation",https://arxiv.org/pdf/1210.1184,"… It is generally held in software engineering that software designs should strive for high-class 
cohesion and low-design coupling. Evolutionary search is, thus, conducted as a single-…"
74,Computation of dynamic program slices for unstructured programs,https://ieeexplore.ieee.org/abstract/document/581327/,"… as we will show, they may compute incorrect dynamic slices for unstructured programs … 
compute dynamic slices. In this paper we present a novel approach of dynamic slice computation …"
75,Playing planning poker in crowds: human computation of software effort estimates,https://eprints.gla.ac.uk/234713/1/234713.pdf,"… We hypothesize that by designing a process that applies human computation[26] to an … 
human computation, we address the following research question: RQ: Given a software task that …"
76,Raw computation,https://www.jstor.org/stable/26058367,"… scientists, software designers and electrical engineers must re… : by exposing its wiring to the 
software system, the chip itself can … But in 1997 a microprocessor with the same computing …"
77,PROOF: A parallel object-oriented functional computation model,https://www.sciencedirect.com/science/article/pii/074373159190125S,"… , software development techniques and programming paradigms supporting software 
engineering … to facilitate the development of large-scale software systems for parallel computing. …"
78,Measuring empirical computational complexity,http://sfg.users.sonic.net/berkeley/trendprof-fse-2007.pdf,"The standard language for describing the asymptotic behavior of algorithms is theoretical 
computational complexity. We propose a method for describing the asymptotic behavior of …"
79,The current state and future of search based software engineering,https://www.academia.edu/download/51417526/Original_20-_20Harman_20-_20The_20Current_20State_20and_20Future_20of_20Search_20Based_20Software_20Engineering.pdf,"… in software engineering. These optimization techniques come from the operations research 
and metaheuristic computation … successful application to software engineering, providing an …"
80,"Separating computation, coordination and configuration",https://onlinelibrary.wiley.com/doi/abs/10.1002/smr.260,"… Since the earliest of times in software engineering, evolution has been considered mainly in 
… However, as a result of e-economics, the scope of software evolution has been expanded in …"
81,[BOOK][B] Designing and building parallel programs: concepts and tools for parallel software engineering,https://dl.acm.org/doi/abs/10.5555/527029,"… Clusters of shared-memory multiprocessors (SMPs) have become the most promising parallel 
computing platforms for scientific computing. However, SMP clusters significantly increase …"
82,[BOOK][B] Modeling in Event-B: system and software engineering,https://citeseerx.ist.psu.edu/document?repid=rep1&type=pdf&doi=0861902a5167a3f98b4fe2532f3a83d6aa4a43d5,"A practical text suitable for an introductory or advanced course in formal methods, this book 
presents a mathematical approach to modelling and designing systems using an extension …"
83,Software framework for distributed experimental–computational simulation of structural systems,https://citeseerx.ist.psu.edu/document?repid=rep1&type=pdf&doi=24d9f69fcc3f43028b1ba061247850839005438e,"… nication protocols, computational models, solution algorithms, and computing resources that 
… presents a software framework for distributed experimental–computational simulation. The …"
84,Qualitative methods in empirical studies of software engineering,https://citeseerx.ist.psu.edu/document?repid=rep1&type=pdf&doi=9846cb0b10aae4128bc27a82cf87b2a947a7c210,"… software engineering for several decades, but have only relatively recently achieved significant 
recognition in the broader software engineering … mathematics or computational nature of …"
85,Closure and convergence: A foundation of fault-tolerant computing,https://citeseerx.ist.psu.edu/document?repid=rep1&type=pdf&doi=15f18ffeb07dc1d25eaf21abc62bfd87d2b5f88c,"The authors formally define what it means for a system to tolerate a class of faults. The definition 
consists of two conditions. The first is that if a fault occurs when the system state is within …"
86,[BOOK][B] Software engineering with reusable components,https://www.academia.edu/download/7109703/10.1.1.94.1888.pdf,"… For example, we can take a procedure and use it for some computations. We can also 
reuse an algorithm that is described in a book on algorithms, like in the book on fundamental …"
87,DESMET: a methodology for evaluating software engineering methods and tools,https://digital-library.theiet.org/content/journals/10.1049/cce_19970304,"… be forgiven for believing that software engineering is only … on the issue of evaluating software 
engineering standards1 I the … approach to evaluation in the field of software engineering. …"
88,A practical guide for using statistical tests to assess randomized algorithms in software engineering,https://homes.cs.washington.edu/~rjust/courses/CSE503/2021_02_26-reading.pdf,"… software engineering … software engineering venues in 2009. Its goal is not to perform a 
complete survey but to get a representative snapshot of current practice in software engineering …"
89,Agent-oriented software engineering: The state of the art,https://citeseerx.ist.psu.edu/document?repid=rep1&type=pdf&doi=d392ac45c071a9f115240c88db73e68a2c553dd9,"… and efficiently engineer than those that simply compute a function … Many researchers now 
believe that in future, computation … Since the 1980s, software agents and multi-agent systems …"
90,Autonomic computing: emerging trends and open problems,https://www.netlab.tkk.fi/opetus/s384030/k06/papers/AutonomicComputingTrendsAndProblems.pdf,"… We believe that from software engineering point of view, autonomic characteristics are highly 
related to quality and non-functional requirements (NFR) [32]. To achieve this, we have to …"
91,Developments in computing work: control and contradiction in the software labour process,https://link.springer.com/chapter/10.1007/978-1-349-26346-2_8,"… , is a picture of the sequence of the software engineering process, predominantly in a 'waterfall' … 
design in the prevailing software engineering ideology (A vergou and Cornford, 1993b). …"
92,[PDF][PDF] User interfaces for symbolic computation: a case study,https://dl.acm.org/doi/pdf/10.1145/168642.168643,"… tools are part of the CAS/PI system, whereas ert emu] tools are software from different origins 
which may … and external software from different origins, we needed an architecture allowing …"
93,[PDF][PDF] N-version programming: A fault-tolerance approach to reliability of software operation,https://www.inf.pucrs.br/zorzo/cs/n-versionprogramming.pdf,"… Berry and the proaramscontributed by the students of his Software Engineering classes in 
1976 and in 1977. Valuable advice and criticism was received fran Professors JA Goguen, Jr. …"
94,Constructing programs from example computations,https://files.eric.ed.gov/fulltext/ED152327.pdf,"An autoprogrammer is an interactive computer programming system which automatically 
constructs computer programs from example computations executed by the user. The example …"
95,Specifying distributed software architectures,https://citeseerx.ist.psu.edu/document?repid=rep1&type=pdf&doi=6677b147ee4f1802cb42ba5ad81f2d37d62ed532,"… This is the level of the design which deals with the high-level organisation of computational 
elements and the interactions between those elements. The paper presents the Darwin …"
96,The GREENSOFT Model: A reference model for green and sustainable software and its engineering,https://www.umwelt-campus.de/fileadmin/Umwelt-Campus/Greensoft/The_GREENSOFT_Model_A_reference_model_fo.pdf,"… the area of computer software and software process models. … Software” and “Green and 
Sustainable Software Engineering”, … for software products, sustainability metrics and criteria for …"
97,Interactive foundations of computing,https://www.sciencedirect.com/science/article/pii/S0304397597001540/pdf?md5=b6d0e1557ddaf949bc10f249723a2aa8&pid=1-s2.0-S0304397597001540-main.pdf&_valck=1,"… for closed finite environments is a challenging research problem, interactive object-oriented 
and agent-oriented models of software engineering and Al are inherently nonalgorithmic. …"
98,An overview of soft computing,https://www.sciencedirect.com/science/article/pii/S1877050916325467/pdf?md5=63ac2b9f91024b9dc01b8a5595234d41&pid=1-s2.0-S1877050916325467-main.pdf&_valck=1,"… computing, as opposed to traditional computing, deals with approximate models and gives 
solutions to complex real-life problems. Unlike hard computing, soft computing … soft computing …"
99,On the naturalness of software,https://dl.acm.org/doi/pdf/10.1145/2902362,"… Indeed there are a great many potential applications to software engineering … computational 
linguistics. We offer evidence supporting an analogous claim for software: though software …"
100,On agent-based software engineering,https://www.sciencedirect.com/science/article/pii/S0004370299001071/pdf?md5=34b0d4b69aa138c15f8d16ca9388dfcd&pid=1-s2.0-S0004370299001071-main.pdf,"… agent-based computing as a serious software engineering … into more traditional software 
engineering concepts. From here, … range of contemporary approaches to software engineering. …"
101,Teaching computational thinking using agile software engineering methods: A framework for middle schools,https://www.researchgate.net/profile/Ilenia-Fronza/publication/319287037_Teaching_Computational_Thinking_Using_Agile_Software_Engineering_Methods_A_Framework_for_Middle_Schools/links/5beda384a6fdcc3a8dd99eaa/Teaching-Computational-Thinking-Using-Agile-Software-Engineering-Methods-A-Framework-for-Middle-Schools.pdf,"… The framework is based on Agile software engineering … The results show that Agile software 
engineering methods are … potential product before using the software tools at hand. Moreover…"
102,[BOOK][B] Experimentation in software engineering,https://enos.itcollege.ee/~edmund/diplomitoo/ethics.pdf,"… Experiments are valuable tools for all software engineers who … software engineering since 
the previous edition's publication. … His focus is system-wide architectures and future computing …"
103,[PDF][PDF] Context and adaptivity in pervasive computing environments: Links with software engineering and ontological engineering.,https://lirias.kuleuven.be/retrieve/114150,"… However approaches presented in the current literature of pervasive computing did not 
really manage to go beyond the borders of traditional computing and software engineering, …"
104,"[BOOK][B] Numerical computation 1: methods, software, and analysis",https://books.google.com/books?hl=en&lr=&id=giH7CAAAQBAJ&oi=fnd&pg=PA1&dq=Software+Engineering+in+computation&ots=DwMDJ3bFtb&sig=Cd10aNUW3LAlzcmuPEovZ4bvWXY,"… of building and using models resembles the development process of computer software 
as expressed, for instance, in the waterfall model or the spiral model of software engineering.3 …"
105,"CloudSim plus: a cloud computing simulation framework pursuing software engineering principles for improved modularity, extensibility and correctness",https://www.academia.edu/download/59103620/CloudSim_Plus_-_Silva_Filho_et_al_201720190501-29767-j2flec.pdf,"… Abstract—Cloud computing is an established technology to provide computing resources … 
framework that pursues conformance to software engineering principles and object-oriented …"
106,[BOOK][B] Fundamentals of software engineering,https://books.google.com/books?hl=en&lr=&id=-JNuDwAAQBAJ&oi=fnd&pg=PP1&dq=Software+Engineering+in+computation&ots=PBHh0VZejf&sig=VzMM3VYnQHfe3OELzwOQAahsERE,"… increase in the raw computing capabilities of computers, software engineers have been called 
… Software engineers have coped up with this challenge by innovating and building upon …"
107,Search-based software engineering,http://tarjomefa.com/wp-content/uploads/2018/04/187-English-TarjomeFa.pdf,"This paper claims that a new field of software engineering research and practice is emerging: 
search-based software engineering. The paper argues that software engineering is ideal …"
108,A software chasm: Software engineering and scientific computing,https://ieeexplore.ieee.org/abstract/document/4375255/,"… taken seriously in the field of computing, and software engineer- … So, the bridge between 
software engineering and any … -computing community nor the software engineering community …"
109,Concurrent models of computation for embedded software,https://escholarship.org/content/qt4pb13878/qt4pb13878.pdf,"… control software) and Lustre/SCADE (created for safety-critical embedded software) offer … 
software engineering. The paper surveys some of the abstractions that have been explored. …"
