,Title,Link,Snippet
0,[PDF][PDF] Software engineering meets evolutionary computation,https://citeseerx.ist.psu.edu/document?repid=rep1&type=pdf&doi=e6f9e4b9942fe6e5265dd1c524cc34f1dd01bdbb,"… forms of evolutionary computation for software engineering. … Evolutionary computation 
for software engineering forms a … in evolutionary computation for software engineering for …"
1,Software engineering as seen through its research literature: A study in co‐word analysis,https://asistdl.onlinelibrary.wiley.com/doi/abs/10.1002/(sici)1097-4571(1998)49:13%3C1206::aid-asi7%3E3.0.co;2-f,"… However, this study focuses on the larger question of how software engineering interacts 
with computing as a whole; ie, on the interactions of software engineering with all other …"
2,[PDF][PDF] Software engineering issues for ubiquitous computing,https://dl.acm.org/doi/pdf/10.1145/302405.302454,"… In this paper, we discuss the software engineering problems that … is that software 
engineering advances are required to support the research endeavors in ubiquitous computing. In …"
3,Next-generation software engineering: Function extraction for computation of software behavior,https://citeseerx.ist.psu.edu/document?repid=rep1&type=pdf&doi=8fd19b6fbfabc610645bcbdb118717acc4807fb7,"… As a computational discipline, we believe that nextgeneration software engineering will 
require extensive capabilities for automated analysis of engineering artifacts, from specifications …"
4,Verifying conceptual domain models with human computation: A case study in software engineering,https://ojs.aaai.org/index.php/HCOMP/article/download/13325/13173,"… and software engineering communities and attracted the first solution approaches using 
human computation. … We show how VeriCoM was applied in a software engineering use case …"
5,WaLBerla: HPC software design for computational engineering simulations,https://citeseerx.ist.psu.edu/document?repid=rep1&type=pdf&doi=0e22cdb7b14e2e14b4bb0a0cb0caa1b9e3018090,"… simulation and high end computing, in particular computational fluid dynamics, multilevel 
methods, and software engineering for high performance computing. He received the ISC …"
6,The state of the art in end-user software engineering,https://kilthub.cmu.edu/articles/journal_contribution/The_State_of_the_Art_in_End-User_Software_Engineering/6470543/files/11899100.pdf,"… to contrast EUSE with professional software engineering, we chose to organize the literature 
by software engineering activities commonly listed in software engineering textbooks (eg, …"
7,"Evolutionary software engineering, a review",https://staff.fmi.uvt.ro/~daniela.zaharie/am2016/proiecte/aplicatii/software_testing/evolutionarySoftwareEngineering.pdf,"… the work applying computational evolutionary methods in software engineering, especially 
in software testing. Testing is both technically and economically vital for high quality software …"
8,"Search-based software engineering: Trends, techniques and applications",https://bura.brunel.ac.uk/bitstream/2438/8811/2/Fulltext.pdf,"… regard software engineering to be truly an engineering discipline, then surely we should 
accept SBSE as a natural consequence; is not optimization the cornerstone of all engineering? …"
9,Agent-oriented software engineering,https://eprints.soton.ac.uk/252182/1/cairo.pdf.gz,"… Computing The first step in arguing for an agent-oriented approach to software engineering 
is to precisely identify and define the key concepts of agent-oriented computing. Here the …"
10,On agent-based software engineering,https://www.sciencedirect.com/science/article/pii/S0004370299001071/pdf?md5=34b0d4b69aa138c15f8d16ca9388dfcd&pid=1-s2.0-S0004370299001071-main.pdf,"… agent-based computing as a serious software engineering … into more traditional software 
engineering concepts. From here, … range of contemporary approaches to software engineering. …"
11,Teaching computational thinking using agile software engineering methods: A framework for middle schools,https://www.researchgate.net/profile/Ilenia-Fronza/publication/319287037_Teaching_Computational_Thinking_Using_Agile_Software_Engineering_Methods_A_Framework_for_Middle_Schools/links/5beda384a6fdcc3a8dd99eaa/Teaching-Computational-Thinking-Using-Agile-Software-Engineering-Methods-A-Framework-for-Middle-Schools.pdf,"… The framework is based on Agile software engineering … The results show that Agile software 
engineering methods are … potential product before using the software tools at hand. Moreover…"
12,[BOOK][B] Experimentation in software engineering,https://enos.itcollege.ee/~edmund/diplomitoo/ethics.pdf,"… Experiments are valuable tools for all software engineers who … software engineering since 
the previous edition's publication. … His focus is system-wide architectures and future computing …"
13,[PDF][PDF] Context and adaptivity in pervasive computing environments: Links with software engineering and ontological engineering.,https://lirias.kuleuven.be/retrieve/114150,"… However approaches presented in the current literature of pervasive computing did not 
really manage to go beyond the borders of traditional computing and software engineering, …"
14,"[BOOK][B] Numerical computation 1: methods, software, and analysis",https://books.google.com/books?hl=en&lr=&id=giH7CAAAQBAJ&oi=fnd&pg=PA1&dq=Software+Engineering+in+computation&ots=DwMDJ3bEAc&sig=RCnv2_rOs4ZSF8BapDVq-0HUB5k,"… of building and using models resembles the development process of computer software 
as expressed, for instance, in the waterfall model or the spiral model of software engineering.3 …"
15,"CloudSim plus: a cloud computing simulation framework pursuing software engineering principles for improved modularity, extensibility and correctness",https://www.academia.edu/download/59103620/CloudSim_Plus_-_Silva_Filho_et_al_201720190501-29767-j2flec.pdf,"… Abstract—Cloud computing is an established technology to provide computing resources … 
framework that pursues conformance to software engineering principles and object-oriented …"
16,[BOOK][B] Fundamentals of software engineering,https://books.google.com/books?hl=en&lr=&id=-JNuDwAAQBAJ&oi=fnd&pg=PP1&dq=Software+Engineering+in+computation&ots=PBHh0VZdqg&sig=0DfUqOw6JvWrCzAFvWY7AG14pmA,"… increase in the raw computing capabilities of computers, software engineers have been called 
… Software engineers have coped up with this challenge by innovating and building upon …"
17,Search-based software engineering,http://tarjomefa.com/wp-content/uploads/2018/04/187-English-TarjomeFa.pdf,"This paper claims that a new field of software engineering research and practice is emerging: 
search-based software engineering. The paper argues that software engineering is ideal …"
18,A software chasm: Software engineering and scientific computing,https://ieeexplore.ieee.org/abstract/document/4375255/,"… taken seriously in the field of computing, and software engineer- … So, the bridge between 
software engineering and any … -computing community nor the software engineering community …"
19,Concurrent models of computation for embedded software,https://escholarship.org/content/qt4pb13878/qt4pb13878.pdf,"… control software) and Lustre/SCADE (created for safety-critical embedded software) offer … 
software engineering. The paper surveys some of the abstractions that have been explored. …"
20,Requirements analysis for engineering computation: A systematic approach for improving reliability,https://link.springer.com/article/10.1007/s11155-006-9020-7,"… This paper argues that the reliability of engineering computation can be significantly improved 
by adopting software engineering methodologies for requirements analysis and specifica…"
21,The dawn of software engineering education,https://lib.iitta.gov.ua/id/eprint/720092/1/paper02.pdf,"… and computational tools for software engineering; know and apply the appropriate 
mathematical concepts, domain methods, system and object-oriented analysis and mathematical …"
22,Quantum software engineering: a new genre of computing,https://dl.acm.org/doi/pdf/10.1145/3663531.3664750,"… software. This paper notably advocates for collaborative e orts between the industrial community 
and software engineer… for the development of quantum software. The proposed vision …"
23,[PDF][PDF] What is computation,http://www.kumlander.eu/itv0010/docs/101108_denning_symposium01.pdf,"… We have been too willing in our field to embrace major terms without clear definitions (for 
example, software engineering, structured programming, and cloud computing). When we do …"
24,"[BOOK][B] Digital signal processing: mathematical and computational methods, software development and applications",https://arrow.tudublin.ie/cgi/viewcontent.cgi?article=1002&context=engschelebk,"… This book provides an account of the mathematical background, computational methods 
and software engineering associated with digital signal processing. The aim has been to …"
25,Software components using symbolic computation for problem solving environments,https://dl.acm.org/doi/pdf/10.1145/281508.281542,"… PSEware has developed particular software components for … computation components, and 
use that experience in a design for a generic \mathematics server"" for existing computational …"
26,[BOOK][B] Software engineering with Ada,https://books.google.com/books?hl=en&lr=&id=iPZGJRW9bKgC&oi=fnd&pg=PR10&dq=Software+Engineering+in+computation&ots=Dv0LJoUxJd&sig=ipNibCaAoVKGCAJyT7c_Zvu8JP0,"… Ideally, we want to collect logically related computational resources in one physical module, 
thus leading us to a module that is cohesively strong. Furthermore, localization implies that …"
27,Computing curricula 2005: The overview report,https://dl.acm.org/doi/abs/10.1145/1124706.1121482,"… guidelines for undergraduate programs in computing. Previous curriculum reports … , computer 
engineering, and software engineering into a single report about computing education. The …"
28,Difference computation of large models,https://ink.library.smu.edu.sg/cgi/viewcontent.cgi?article=9857&context=sis_research,"… software engineering … The computation of a difference between large models is a big 
challenge; current algorithms are too inefficient here. We present a new technique for computing …"
29,First-principles computation of material properties: the ABINIT software project,https://www.academia.edu/download/60830567/First-principles_computation_of_material_1_20191007-30129-ijrnxv.pdf,"… The density functional theory (DFT) computation of … DFT software project can benefit 
enormously from widespread collaboration, if handled properly. Also, modern software engineering …"
30,[PDF][PDF] Software for numerical computation,https://docs.lib.purdue.edu/cgi/viewcontent.cgi?article=1153&context=cstech,"… software and thus it is natural to attempt to separate software research from numerical 
computation … We want to define numerical computation rather precisely so as to distinguish it from …"
31,A survey on deep learning for software engineering,https://arxiv.org/pdf/2011.14597,"… graphics processing units significantly reduced the computation time of DL-based algo… 
software engineering (SE) tasks, including requirements, software design and modeling, software …"
32,A software engineering framework for context-aware pervasive computing,https://citeseerx.ist.psu.edu/document?repid=rep1&type=pdf&doi=286c57dd231dcac718f556f76ece89db7571d380,"… a software engineering framework that addresses these challenges: the first by simplifying 
design and implementation tasks associated with context-aware software, and … into a software …"
33,[BOOK][B] Numerical methods in software and analysis,https://books.google.com/books?hl=en&lr=&id=4JrOBQAAQBAJ&oi=fnd&pg=PP1&dq=Software+Engineering+in+computation&ots=XOB2Z4hwEX&sig=r92hlzTFTjPkhZKISH2dO8ch0iA,"… methods and ideas of numerical computation. Part III contains very relevant, but somewhat 
independent, material about software engineering and performance evaluation. There is …"
34,"Verification, validation, and predictive capability in computational engineering and physics",https://www.osti.gov/servlets/purl/918370-mb55XB/,"… to all fields of computational engineering and physics, eg, computational fluid dynamics, … 
working on computational physics codes do not like to be thought of as software engineers. A …"
35,[BOOK][B] Histories of computing,https://books.google.com/books?hl=en&lr=&id=bKlJEAAAQBAJ&oi=fnd&pg=PP1&dq=Software+Engineering+in+computation&ots=RuGCsI06cR&sig=Z-nffW1Kp1t6tapjCahxcKYxhtw,"… the history of computing, in contrast to work in other areas of science studies and the history 
of technology.7 The papers he wrote on the history of software and software engineering are …"
36,"[CITATION][C] Software Engineering, 9/E",https://unidel.edu.ng/focelibrary/books/Software-Engineering-9th-Edition-by-Ian-Sommerville-2009.pdf,
37,[PDF][PDF] Cleanroom software engineering,https://trace.tennessee.edu/cgi/viewcontent.cgi?article=1017&context=utk_harlan,"… This basis requires a software specification and a probability distribution on scenarios of 
the software's use; it then defines a testing procedure and a prescribed computation from test …"
38,Search-based software test data generation using evolutionary computation,https://arxiv.org/pdf/1103.0125,"… Search-based Software Engineering has been utilized for a number of software engineering 
activities. One area where Search-Based Software Engineering has seen much application …"
39,Agent-based software engineering,https://citeseerx.ist.psu.edu/document?repid=rep1&type=pdf&doi=606b072c6ca0f03cbaa3757f5897748b3921d466,"… component of agent-based computing. The concept was artic… Hopefully, this computational 
model corresponds to our own … from a more mainstream computing discipline have adopted …"
40,Preliminary guidelines for empirical research in software engineering,https://www.st.cs.uni-saarland.de/edu/recommendation-systems/papers/1082.pdf,"… Hoaglin is a statistician who has long been interested in software and computing. He 
reviewed eight papers published in Transactions on Software Engineering in the last few years. …"
41,Computer as thinker/doer: Problem-solving environments for computational science,https://ieeexplore.ieee.org/abstract/document/326669/,"… By their nature, PSEs are complicated and massive software systems. Their construction 
requires software engineering techniques such as modularization, decomposability, and informa…"
42,The software model checker Blast Applications to software engineering,https://citeseerx.ist.psu.edu/document?repid=rep1&type=pdf&doi=f8fda3205824f9cbf96fda9c3b9465e9ced86022,"… We use the path to q to compute a test vector that covers the location q wrt p using a procedure 
described below. We add this vector to the test suite, and remove q from the worklist. In …"
43,There is no software,https://journals.uvic.ca/index.php/ctheory/article/download/14655/5522,"… The crazy kind of software engineering that was writing … This is what we actually do when 
we compute up a model of the … structures of computation, and very far from Turing machines.…"
44,Organizational social structures for software engineering,https://www.academia.edu/download/31309150/acm_csur_oss.pdf,"… First, software engineering focused on building software using … be further explored for software 
development: social networks. … -aware software engineering, that is, to engineer software …"
45,[BOOK][B] Automated theorem proving in software engineering,https://books.google.com/books?hl=en&lr=&id=GQdJCAAAQBAJ&oi=fnd&pg=PA1&dq=Software+Engineering+in+computation&ots=gJa7Le38le&sig=gbs_UMlgqj596p-9iRP-lWermdQ,"… We explore the rising demands on software engineering and conclude that within many 
phases of the software life-cycle tasks arise which require the use of formal methods (Chapter 2). …"
46,An architecture for distributing the computation of software clustering algorithms,https://www.cs.drexel.edu/~bmitchell/pubs/wicsa2001.pdf,"… Java, from the Drexel University Software Engineering Group's (SERG) web page at: http://serg.mcs.drexel.edu. 
In addition to downloading a copy of our software, the SERG web page …"
47,Property-based software engineering measurement,ftp://banach.ing-mat.udec.cl/pub/ing-mat/asignaturas/520135/laboratorios/mediciones-software.pdf,"… software artifacts to which these concepts are applied. Such a mathematical framework 
could generate a consensus in the software engineering … the means to compute the size of a …"
48,A survey of the practice of computational science,https://oar.princeton.edu/bitstream/88435/pr12j96/1/SurveyComputationalScience.pdf,"… While covering the correctness and software engineering aspects of computational science, 
the survey presented in this paper also addressed the need for computational performance, …"
49,[PDF][PDF] Evolutionary computing in search-based software engineering,https://citeseerx.ist.psu.edu/document?repid=rep1&type=pdf&doi=8ad936e1116aaaf49bc511a396ce384e3182a404,"… This Chapter represents briefly the overall structure of this document, research objectives, 
and the background concepts related to this research: software engineering, computational …"
50,Requirement emergence computation of networked software,https://journal.hep.com.cn/fcs/EN/article/downloadArticleFile.do?attachType=PDF&id=6415,"… argue that the software and software engineering should be … software network view for the 
software engineering in complex systems is proposed. The description of networked software …"
51,[PDF][PDF] Enhancing theory of computation teaching through integration with other courses,https://www.academia.edu/download/77824371/ijrte0102137140.pdf,"… engineering, microprocessors, software engineering. 3. The students were motivated to study 
… Active learning of the students through software tools so that they should have” hands on “…"
52,Teaching cloud computing: a software engineering perspective,https://www.sciencedirect.com/science/article/pii/S0164121213000198,"… computing in a software engineering course. It suggests that all courses should have some 
material introducing students to cloud computing… in cloud software engineering covering map-…"
53,A survey of the use of crowdsourcing in software engineering,https://discovery.ucl.ac.uk/id/eprint/1515855/1/JSS-ke.pdf,"… in software engineering and corresponding case studies. We further analyse the software 
engineering … involved in realising Crowdsourced Software Engineering solutions. We conclude …"
54,Genericity in evolutionary computation software tools: Principles and case-study,https://citeseerx.ist.psu.edu/document?repid=rep1&type=pdf&doi=2ebb0d46e2c08192d29236086d086323d66d6961,"… deals with the need for generic software development tools in evolutionary computations (EC). … 
EC software tool development includes many issues. From the software engineering point …"
55,A brief history of software engineering,https://mediaweb.saintleo.edu/Courses/COM430/M1Readings/A%20Brief%20History%20of%20Software%20Engineering.pdf,"… rapid growth of computing power has made it possible in recent years to apply computing to 
tasks … Because this issue lies at the very core of software engineering, we need to elaborate. …"
56,Law is code: a software engineering approach to analyzing the United States code,https://digitalcommons.law.umaryland.edu/cgi/viewcontent.cgi?article=1246&context=jbtl,"… We take a computational approach to studying the full text of the United States Code (""US … 
that software engineers use to analyze the evolution and structure of large software codebases…"
57,[BOOK][B] The science of computing: shaping a discipline,https://books.google.com/books?hl=en&lr=&id=I2tYBQAAQBAJ&oi=fnd&pg=PP1&dq=Software+Engineering+in+computation&ots=3O_sOyaS8m&sig=A0iThHaK4K2W1ve2kjGsivdxL8Y,"… “That’s not computer science,” a professor told me when I abandoned the traditional computer 
science and software engineering study tracks to pursue computing topics that I thought to …"
58,The “physics” of notations: toward a scientific basis for constructing visual notations in software engineering,https://cs.uwaterloo.ca/~jmatlee/Teaching/CS846/Schedule/Jan30/Kevin.pdf,"Visual notations form an integral part of the language of software engineering (SE). Yet 
historically, SE researchers and notation designers have ignored or undervalued issues of visual …"
59,HPCMP CREATE-AV quality assurance: Lessons learned by validating and supporting computation-based engineering software,https://ieeexplore.ieee.org/abstract/document/7325179/,"… by developing and deploying advanced computational engineering design and simulation 
tools for military aircraft. While quality in newly developed software should be built in from the …"
60,Sustainability in Software Engineering Education: a case of general professional competencies,https://lib.iitta.gov.ua/720201/1/e3sconf_icsf2020_10036.pdf,"… software engineering specialists training. A system of general professional competencies is 
designed to build sustainable professional competence of software engineering … computing …"
61,Abstractions for software architecture and tools to support them,http://www.cs.cmu.edu/afs/cs/project/vit/ftp/pdf/UniCon.pdf,"… Select connectors that are available in the local computing environment so we can 
concentrate on providing them, not inventing them; however, select with diversity in mind. …"
62,Development of software effort and schedule estimation models using soft computing techniques,https://www.academia.edu/download/50818125/Development_of_Software_Effort_and_Sched20161210-31662-s7cmbd.pdf,"… In [15], author provided a strategic solution for estimating software defect using self-organizing 
neural network. Fuzzy logic and neural networks were used in software engineering …"
63,On the applicability of evolutionary computation for software defect prediction,https://ieeexplore.ieee.org/abstract/document/6968592/,"… evolutionary computation techniques makes them better suited to the software engineering 
… of the evolutionary computation and hybridized evolutionary computation techniques for …"
64,"Causality, information and biological computation: An algorithmic software approach to life, disease and the immune system",https://arxiv.org/pdf/1508.06538,"… information theory and software engineering, in the context … a translation exercise from 
computing to molecular biology and … them afresh from a software-engineering viewpoint that casts …"
65,A comparison of some soft computing methods for software fault prediction,https://www.sciencedirect.com/science/article/pii/S0957417414006496,"… Data used in this study are collected from the PROMISE Software Engineering Repository, 
and McCabe metrics are selected because they comprehensively address the programming …"
66,High dimensional search-based software engineering: finding tradeoffs among 15 objectives for automating software refactoring using NSGA-III,https://researchrepository.ul.ie/articles/conference_contribution/High_dimensional_search-based_software_engineering_finding_tradeoffs_among_15_objectives_for_automating_software_refactoring_using_NSGA-III/19853602/1/files/35269711.pdf,"… the software design after applying refactoring operations, but current search-based software 
engineering … We propose for the first time a scalable search-based software engineering …"
67,"[BOOK][B] Financial engineering and computation: principles, mathematics, algorithms",https://books.google.com/books?hl=en&lr=&id=iispAwAAQBAJ&oi=fnd&pg=PP1&dq=Software+Engineering+in+computation&ots=dV_fEPmSsG&sig=LVOKec39-vwJO2Nt00CXV_zDsEY,"… It is a remarkable fact that most – if not all – of the programming works could have been 
done with spreadsheet software [221, 708]. Some computing platforms admit the integration of …"
68,Integrating modern research into numerical computation education,https://ieeexplore.ieee.org/abstract/document/4293740/,"… They’re also competing on a particular piece of computational software or a programming 
language for preferential use as a teaching tool, one that instructors might favor over others. …"
69,How do scientists develop and use scientific software?,https://citeseerx.ist.psu.edu/document?repid=rep1&type=pdf&doi=b99f1652926c23ee45fba1ad62d799d04a1740b4,"… to rank standard software engineering concepts higher if they work in large software development 
… between rank of importance of software engineering concepts and project/team size. …"
70,JCLEC: a Java framework for evolutionary computation,https://sci2s.ugr.es/sites/default/files/files/Teaching/OtherPostGraduateCourses/FutureDirectionsinSoftComputing/Bibliografia/JCELC-online-accepted.pdf,"… Abstract In this paper we describe JCLEC, a Java software system for the development of 
evolutionary computation applications. This system has been designed as a framework, …"
71,On contemporary denotational mathematics for computational intelligence,https://www.researchgate.net/profile/Yingxu-Wang-3/publication/220110185_On_Contemporary_Denotational_Mathematics_for_Computational_Intelligence/links/00b4952055ebb153c2000000/On-Contemporary-Denotational-Mathematics-for-Computational-Intelligence.pdf,"… informatics, computational intelligence, software engineering, and knowledge engineering. 
… learning by concept algebra, and the modeling of granular computing by system algebra. …"
